[
  {
    "id": "sekou-denki-2026-f1-001",
    "exam": "1級電気工事施工管理技士",
    "examStage": "第一次検定",
    "year": 2026,
    "eraYear": "令和8年度",
    "part": "午前",
    "officialQuestionNo": 1,
    "category": "電気工学",
    "subcategory": "電気基礎",
    "difficulty": "medium",
    "answerFormat": "single_choice",
    "choiceCount": 4,
    "question": "面積0.4m2、誘電体の厚さ2mm、比誘電率4の平行板コンデンサがある。静電容量を真空の誘電率ε0を用いて表すと、最も近いものはどれか。",
    "choices": ["3.2ε0 F", "20ε0 F", "800ε0 F", "5000ε0 F"],
    "correctIndex": 2,
    "answerLabel": "3",
    "explanation": "平行板コンデンサの静電容量は C = εr ε0 A / d。A=0.4、d=0.002、εr=4より、C = 4ε0×0.4/0.002 = 800ε0 F。",
    "learningPoint": "平行板コンデンサの静電容量",
    "sourceFacts": {
      "formula": "C = εr ε0 A / d",
      "areaM2": 0.4,
      "thicknessM": 0.002,
      "relativePermittivity": 4
    },
    "expressionPolicy": "official_past_question_referenced; question_text_generated",
    "isModified": true,
    "source": "一般財団法人建設業振興基金公表の令和8年度第一次検定問題・正答肢を参考にした学習用類題",
    "sourceUrl": "https://www.fcip-shiken.jp/pdf/r08_1dg_mondai.pdf",
    "sourceCheckedAt": "2026-07-20"
  },
  {
    "id": "sekou-denki-2026-f1-002",
    "exam": "1級電気工事施工管理技士",
    "examStage": "第一次検定",
    "year": 2026,
    "eraYear": "令和8年度",
    "part": "午前",
    "officialQuestionNo": 2,
    "category": "電気工学",
    "subcategory": "電界",
    "difficulty": "medium",
    "answerFormat": "single_choice",
    "choiceCount": 4,
    "question": "一様な電界の強さが5V/mで、電界方向に2mだけ正電荷2Cを移動させるとき、電界に逆らって外力が行う仕事の大きさとして正しいものはどれか。",
    "choices": ["2J", "5J", "10J", "20J"],
    "correctIndex": 3,
    "answerLabel": "4",
    "explanation": "電位差は V = Ed = 5×2 = 10V。電荷Q=2Cを移動させる仕事は W = QV = 2×10 = 20J。",
    "learningPoint": "電界中の電荷移動と仕事",
    "sourceFacts": {
      "electricFieldVm": 5,
      "chargeC": 2,
      "distanceM": 2
    },
    "expressionPolicy": "official_past_question_referenced; question_text_generated",
    "isModified": true,
    "source": "一般財団法人建設業振興基金公表の令和8年度第一次検定問題・正答肢を参考にした学習用類題",
    "sourceUrl": "https://www.fcip-shiken.jp/pdf/r08_1dg_mondai.pdf",
    "sourceCheckedAt": "2026-07-20"
  },
  {
    "id": "sekou-denki-2026-f1-055",
    "exam": "1級電気工事施工管理技士",
    "examStage": "第一次検定",
    "year": 2026,
    "eraYear": "令和8年度",
    "part": "午後",
    "officialQuestionNo": 55,
    "category": "施工管理法",
    "subcategory": "応用能力",
    "difficulty": "hard",
    "answerFormat": "single_choice",
    "choiceCount": 5,
    "question": "工程管理で用いるネットワーク工程表に関する説明として、最も適切なものはどれか。",
    "choices": ["クリティカルパスは全作業のうち最も費用が高い作業の連なりをいう", "フリーフロートは後続作業の最早開始時刻に影響しない余裕時間をいう", "トータルフロートは必ず全作業で0となる", "ダミー作業は必ず実作業時間を伴う", "結合点番号は作業の優先順位を表すため大きいほど先に着手する"],
    "correctIndex": 1,
    "answerLabel": "2",
    "explanation": "フリーフロートは、その作業を遅らせても直後の作業の最早開始時刻に影響しない余裕時間。クリティカルパスは工期を支配する経路で、余裕時間が0の作業が連なる。",
    "learningPoint": "ネットワーク工程表の余裕時間",
    "sourceFacts": {
      "topic": "network_schedule",
      "answerType": "definition"
    },
    "expressionPolicy": "official_past_question_referenced; question_text_generated",
    "isModified": true,
    "source": "一般財団法人建設業振興基金公表の令和8年度第一次検定問題・正答肢を参考にした学習用類題",
    "sourceUrl": "https://www.fcip-shiken.jp/pdf/r08_1dg_mondai.pdf",
    "sourceCheckedAt": "2026-07-20"
  },
  {
    "id": "sekou-denki-2025-f1-001",
    "exam": "1級電気工事施工管理技士",
    "examStage": "第一次検定",
    "year": 2025,
    "eraYear": "令和7年度",
    "part": "午前",
    "officialQuestionNo": 1,
    "category": "電気工学",
    "subcategory": "電気基礎",
    "difficulty": "medium",
    "answerFormat": "single_choice",
    "choiceCount": 4,
    "question": "直流回路で、抵抗に流れる電流が2A、端子電圧が100Vである。この抵抗で消費される電力として正しいものはどれか。",
    "choices": ["50W", "100W", "200W", "400W"],
    "correctIndex": 2,
    "answerLabel": "3",
    "explanation": "直流回路の電力は P = VI。V=100V、I=2Aより P=200W。",
    "learningPoint": "直流回路の電力計算",
    "sourceFacts": {
      "voltageV": 100,
      "currentA": 2,
      "formula": "P = VI"
    },
    "expressionPolicy": "official_past_question_referenced; question_text_generated",
    "isModified": true,
    "source": "一般財団法人建設業振興基金公表の令和7年度第一次検定問題・正答肢を参考にした学習用類題",
    "sourceUrl": "https://www.fcip-shiken.jp/pdf/r07_1dg_mondai.pdf",
    "sourceCheckedAt": "2026-07-20"
  },
  {
    "id": "sekou-denki-2025-f1-013",
    "exam": "1級電気工事施工管理技士",
    "examStage": "第一次検定",
    "year": 2025,
    "eraYear": "令和7年度",
    "part": "午前",
    "officialQuestionNo": 13,
    "category": "電気設備",
    "subcategory": "受変電設備",
    "difficulty": "medium",
    "answerFormat": "single_choice",
    "choiceCount": 4,
    "question": "受変電設備で用いられる計器用変成器の説明として、最も適切なものはどれか。",
    "choices": ["変流器は大電流を計器で扱いやすい小電流に変換する", "変圧器は短絡電流を遮断することを主目的とする", "避雷器は通常運転時の力率を改善する", "断路器は負荷電流を頻繁に開閉するための機器である"],
    "correctIndex": 0,
    "answerLabel": "1",
    "explanation": "変流器（CT）は大電流を標準的な小電流へ変換し、電流計や保護継電器に入力する。断路器は原則として負荷電流の開閉には用いない。",
    "learningPoint": "受変電設備の機器の役割",
    "sourceFacts": {
      "topic": "instrument_transformer",
      "device": "CT"
    },
    "expressionPolicy": "official_past_question_referenced; question_text_generated",
    "isModified": true,
    "source": "一般財団法人建設業振興基金公表の令和7年度第一次検定問題・正答肢を参考にした学習用類題",
    "sourceUrl": "https://www.fcip-shiken.jp/pdf/r07_1dg_mondai.pdf",
    "sourceCheckedAt": "2026-07-20"
  },
  {
    "id": "sekou-denki-2025-f1-080",
    "exam": "1級電気工事施工管理技士",
    "examStage": "第一次検定",
    "year": 2025,
    "eraYear": "令和7年度",
    "part": "午後",
    "officialQuestionNo": 80,
    "category": "法規",
    "subcategory": "建設業法",
    "difficulty": "medium",
    "answerFormat": "single_choice",
    "choiceCount": 4,
    "question": "建設業法における主任技術者・監理技術者に関する説明として、最も適切なものはどれか。",
    "choices": ["監理技術者は下請契約の総額に関係なく常に不要である", "主任技術者はすべての建設工事で配置が不要である", "発注者から直接請け負った工事で一定額以上を下請契約する場合は監理技術者の配置が必要となる", "主任技術者と現場代理人は法律上必ず同一人物でなければならない"],
    "correctIndex": 2,
    "answerLabel": "3",
    "explanation": "建設業法では、元請として一定額以上を下請に出す場合、主任技術者ではなく監理技術者の配置が必要となる。金額要件は改正されることがあるため最新法令で確認する。",
    "learningPoint": "主任技術者と監理技術者",
    "sourceFacts": {
      "law": "建設業法",
      "topic": "技術者配置"
    },
    "expressionPolicy": "official_past_question_referenced; question_text_generated",
    "isModified": true,
    "source": "一般財団法人建設業振興基金公表の令和7年度第一次検定問題・正答肢を参考にした学習用類題",
    "sourceUrl": "https://www.fcip-shiken.jp/pdf/r07_1dg_mondai.pdf",
    "sourceCheckedAt": "2026-07-20"
  },
  {
    "id": "sekou-denki-2024-f1-001",
    "exam": "1級電気工事施工管理技士",
    "examStage": "第一次検定",
    "year": 2024,
    "eraYear": "令和6年度",
    "part": "午前",
    "officialQuestionNo": 1,
    "category": "電気工学",
    "subcategory": "交流回路",
    "difficulty": "medium",
    "answerFormat": "single_choice",
    "choiceCount": 4,
    "question": "単相交流回路で、電圧200V、電流10A、力率0.8の負荷が消費する有効電力として正しいものはどれか。",
    "choices": ["160W", "800W", "1600W", "2500W"],
    "correctIndex": 2,
    "answerLabel": "3",
    "explanation": "単相交流の有効電力は P = VIcosθ。200×10×0.8 = 1600W。",
    "learningPoint": "単相交流の有効電力",
    "sourceFacts": {
      "voltageV": 200,
      "currentA": 10,
      "powerFactor": 0.8,
      "formula": "P = VIcosθ"
    },
    "expressionPolicy": "official_past_question_referenced; question_text_generated",
    "isModified": true,
    "source": "一般財団法人建設業振興基金公表の令和6年度第一次検定問題・正答肢を参考にした学習用類題",
    "sourceUrl": "https://www.fcip-shiken.jp/pdf/r06_1dg_mondai.pdf",
    "sourceCheckedAt": "2026-07-20"
  },
  {
    "id": "sekou-denki-2024-f1-045",
    "exam": "1級電気工事施工管理技士",
    "examStage": "第一次検定",
    "year": 2024,
    "eraYear": "令和6年度",
    "part": "午前",
    "officialQuestionNo": 45,
    "category": "関連分野",
    "subcategory": "建築設備",
    "difficulty": "medium",
    "answerFormat": "single_choice",
    "choiceCount": 4,
    "question": "非常用照明設備に関する説明として、最も適切なものはどれか。",
    "choices": ["停電時の避難経路の視認性を確保するために設ける", "常時の室内照度を高くするためだけに設ける", "受変電設備の力率を改善するために設ける", "雷サージを大地へ逃がすために設ける"],
    "correctIndex": 0,
    "answerLabel": "1",
    "explanation": "非常用照明設備は、火災や停電時などに避難に必要な明るさを確保するための設備。力率改善や雷保護を目的とする設備ではない。",
    "learningPoint": "建築設備と避難安全",
    "sourceFacts": {
      "topic": "emergency_lighting"
    },
    "expressionPolicy": "official_past_question_referenced; question_text_generated",
    "isModified": true,
    "source": "一般財団法人建設業振興基金公表の令和6年度第一次検定問題・正答肢を参考にした学習用類題",
    "sourceUrl": "https://www.fcip-shiken.jp/pdf/r06_1dg_mondai.pdf",
    "sourceCheckedAt": "2026-07-20"
  },
  {
    "id": "sekou-denki-2024-f1-064",
    "exam": "1級電気工事施工管理技士",
    "examStage": "第一次検定",
    "year": 2024,
    "eraYear": "令和6年度",
    "part": "午後",
    "officialQuestionNo": 64,
    "category": "施工管理法",
    "subcategory": "品質管理",
    "difficulty": "medium",
    "answerFormat": "single_choice",
    "choiceCount": 4,
    "question": "品質管理で用いる管理図に関する説明として、最も適切なものはどれか。",
    "choices": ["工程が統計的に安定しているかを判断するために用いる", "作業員の出面を記録するためだけに用いる", "工事費の支払時期を示すために用いる", "施工図の縮尺を統一するために用いる"],
    "correctIndex": 0,
    "answerLabel": "1",
    "explanation": "管理図は、測定値のばらつきや異常傾向を見て工程の安定状態を判断する品質管理手法。工程表や出来高表とは目的が異なる。",
    "learningPoint": "品質管理の七つ道具",
    "sourceFacts": {
      "topic": "control_chart"
    },
    "expressionPolicy": "official_past_question_referenced; question_text_generated",
    "isModified": true,
    "source": "一般財団法人建設業振興基金公表の令和6年度第一次検定問題・正答肢を参考にした学習用類題",
    "sourceUrl": "https://www.fcip-shiken.jp/pdf/r06_1dg_mondai.pdf",
    "sourceCheckedAt": "2026-07-20"
  }
]
